145428,201503070006,2015,3,7,,0,,4,Afghanistan,6,South Asia,Kabul,Kabul,34.516895,69.147014,1.0,0,,"03/07/2015: Assailants opened fire on a Sufi mosque in Kabul city, Kabul province, Afghanistan. Five people were killed and six others were wounded in the attack. No group claimed responsibility for the incident.",1,1,1,0,,,0.0,1,0,2,Armed Assault,,,,,15,Religious Figures/Institutions,86.0,Place of Worship,Bahadur Aaq Monastery,Sufi Mosque,4.0,Afghanistan,,,,,,,,,,,,,,,,,Unknown,,,,,,,0.0,,,0,2.0,0.0,0.0,,,,,,,,,,5,Firearms,3.0,Handgun,,,,,,,,,,,,,Handguns fitted with silencers were used in the attack.,5.0,0.0,0.0,6.0,0.0,0.0,0,,,,,0.0,,,,,,,,,,,,,,,,"Casualty numbers for this incident conflict across sources. Following GTD protocol, the lowest reliable estimates are reported here.","""Six killed in gunmen attack on Sufi place of worship in Kabul,"" Reuters, March 7, 2015.","""6 killed in Afghan capital mosque attack,"" Xinhua News Agency, March 7, 2015.","""Highlights: Pakistan Pashto Press 9 March, 2015,"" OSC Summary, March 9, 2015.",START Primary Collection,-9,-9,0,-9,
147625,201504290072,2015,4,29,,0,,4,Afghanistan,6,South Asia,Kabul,Kabul,34.516895,69.147014,1.0,0,The incident occurred in the Wazir Akbar Khan neighborhood,"04/29/2015: Assailants attacked Wazir Akbar Khan neighborhood, Kabul city, Kabul province, Afghanistan. Four assailants were killed during the attack. The Taliban claimed responsibility for the incident.",1,1,1,0,,,0.0,1,0,3,Bombing/Explosion,2.0,Armed Assault,,,14,Private Citizens & Property,75.0,Village/City/Town/Suburb,Wazir Akbar Khan Neighborhood,Neighborhood,4.0,Afghanistan,,,,,,,,,,,,,,,,,Taliban,,,,,,The Taliban claimed responsibility for the incident and stated that Wazir Akbar Khan district was targeted because the group believed it was housing foreign installations.,0.0,,,0,4.0,0.0,1.0,7.0,"Posted to website, blog, etc.",,,,,,,,6,Explosives,16.0,Unknown Explosive Type,5.0,Firearms,2.0,Automatic or Semi-Automatic Rifle,,,,,,,,,,4.0,0.0,4.0,0.0,0.0,0.0,-9,,,,It is unknown if any property was damaged in this attack.,0.0,,,,,,,,,,,,,,,,,"""Taliban welcome Afghan peace efforts after informal talks in Qatar,"" Daily Mirror Sri Lanka, May 4, 2015.",,,START Primary Collection,0,0,0,0,
150669,201507110051,2015,7,11,,0,,4,Afghanistan,6,South Asia,Kabul,Kabul,34.516895,69.147014,1.0,0,The incident occurred in the Bagrami neighborhood,"07/11/2015: Two suicide bombers on a motorcycle detonated before reaching their target in Bagrami neighborhood, Kabul city, Kabul province, Afghanistan. In addition to the two assailants, three people were killed and one person was injured in the blast. No group claimed responsibility for the incident.",1,1,1,0,,,0.0,1,1,3,Bombing/Explosion,,,,,20,Unknown,,,Unknown,Unknown,,,,,,,,,,,,,,,,,,,Unknown,,,,,,,0.0,,,0,2.0,0.0,0.0,,,,,,,,,,6,Explosives,15.0,Vehicle,,,,,,,,,,,,,An explosives-laden motorcycle was used in the attack.,5.0,0.0,2.0,1.0,0.0,0.0,0,,,,,0.0,,,,,,,,,,,,,,,,"Casualty numbers for this incident conflict across sources. Following GTD protocol, the lowest reliable estimates are reported here.","""Xinhua: 1st LD: Two Suicide Bombers Killed In Afghan Capital Explosion,"" Xinhua, July 11, 2015.","""Afghan police say Kabul blast kills five,"" Afghan Islamic Press, July 11, 2015.","""Two suicide bombers killed in Kabul,"" Big News Network, July 11, 2015.",START Primary Collection,-9,-9,1,1,
154190,201510080007,2015,10,8,,0,,4,Afghanistan,6,South Asia,Kabul,Kabul,34.516895,69.147014,1.0,0,,"10/08/2015: Two suicide bombers armed with explosives and firearms attack the Kolbah Solh Restaurant in western Kabul city, Kabul province, Afghanistan. Two civilians and both assailants were killed and three civilians were injured in the assault. No group claimed responsibility for the incident; however, sources attributed the attack to the Taliban.",1,1,1,0,,,0.0,1,1,3,Bombing/Explosion,,,,,1,Business,2.0,Restaurant/Bar/Café,Kolbah Solh Restaurant,Restaurant,4.0,Afghanistan,,,,,,,,,,,,,,,,,Taliban,,,,,,"The specific motive is unknown; however, sources posited that the Taliban targeted Kolbah Solh Restaurant because the group believed it was ""spreading vulgarity.""",0.0,,,0,2.0,0.0,0.0,,,,,,,,,,6,Explosives,13.0,Suicide (carried bodily by human being),6.0,Explosives,7.0,Grenade,5.0,Firearms,2.0,Automatic or Semi-Automatic Rifle,,,,,Hand grenades and AK-47 assault rifles were used in the attack.,4.0,0.0,2.0,3.0,0.0,0.0,-9,,,,It is unknown if any property was damaged in this attack.,0.0,,,,,,,,,,,,,,,,,"""Gunmen among 4 perished in Kabul restaurant attack,"" Frontier Post, October 10, 2015.","""ISIS claims responsibility for the attack on religious hall in Kabul,"" Khaama Press, October 9, 2015.","""2 militants killed after attacking a restaurant in Kabul city,"" Khaama Press, October 9, 2015.",START Primary Collection,0,0,0,0,
156107,201511240008,2015,11,24,,0,,4,Afghanistan,6,South Asia,Kabul,Kabul,34.516895,69.147014,1.0,0,The incident occurred in the Afshar area.,"11/24/2015: An explosive device detonated at the Kabul Education University in Afshar area, Kabul city, Kabul province, Afghanistan. Three civilians were killed in the blast. No group claimed responsibility for the incident.",1,1,1,0,,,0.0,1,0,3,Bombing/Explosion,,,,,8,Educational Institution,49.0,School/University/Educational Building,Kabul Education University,University,4.0,Afghanistan,,,,,,,,,,,,,,,,,Unknown,,,,,,,0.0,,,0,-99.0,0.0,0.0,,,,,,,,,,6,Explosives,17.0,Other Explosive Type,,,,,,,,,,,,,An explosives-laden cooker was used in the attack.,3.0,0.0,0.0,0.0,0.0,0.0,-9,,,,It is unknown if any property was damaged in this attack.,0.0,,,,,,,,,,,,,,,,,"""Afghan agency says 11 people killed in Kabul blasts,"" Afghan Islamic Press, November 24, 2015.","""6 killed in Afghan capital blasts,"" Xinhua General News Service, November 24, 2015.","""Afghan Capital Blasts Kills Six,"" New Indian Express, November 24, 2015.",START Primary Collection,-9,-9,0,-9,
157466,201601010010,2016,1,1,,0,,4,Afghanistan,6,South Asia,Kabul,Kabul,34.516895,69.147014,1.0,0,The incident occurred in the Taimani neighborhood on Street 9.,"01/01/2016: A suicide bomber detonated an explosives-laden vehicle at Le Jardin restaurant in Taimani neighborhood, Kabul city, Kabul province, Afghanistan. Two people were killed and 18 people were injured in the blast. The Taliban claimed responsibility for the attack.",1,1,1,0,,,0.0,1,1,3,Bombing/Explosion,,,,,1,Business,2.0,Restaurant/Bar/Café,Le Jardin,Restaurant,4.0,Afghanistan,,,,,,,,,,,,,,,,,Taliban,,,,,,,0.0,,,0,3.0,1.0,1.0,8.0,Personal claim,,,,,,,,6,Explosives,15.0,Vehicle,,,,,,,,,,,,,,3.0,0.0,1.0,18.0,0.0,0.0,1,4.0,Unknown,-99.0,A restaurant and an unknown number of houses were damaged in this attack.,0.0,,,,,,,,,,,,,,,,"Casualty numbers for this incident conflict across sources. Following GTD protocol, the most recent reliable estimates are reported here.","""Taliban Attack Kabul Restaurant, Setting Off Shootout,"" New York Times, January 1, 2016.","""Suicide bombing hits restaurant in Afghan capital Kabul,"" Reuters, January 1, 2016.","""Afghanistan: 4 terrorists killed in premature truck bombing in Herat,"" Khaama Press, January 3, 2016.",START Primary Collection,0,0,0,0,
165546,201607230001,2016,7,23,,0,,4,Afghanistan,6,South Asia,Kabul,Kabul,34.516895,69.147014,1.0,0,The incident occurred in the 3rd police district.,"07/23/2016: Two suicide bombers detonated targeting a Hazara protest in Kabul, Afghanistan. A third assailant was shot and killed before successfully detonating. In addition to the three assailants, at least 80 people were killed and 230 people were injured in the blasts. The Khorasan Chapter of the Islamic State claimed responsibility for the incident.",1,1,1,0,,,0.0,1,1,3,Bombing/Explosion,,,,,14,Private Citizens & Property,83.0,Protester,Not Applicable,Protesters,4.0,Afghanistan,,,,,,,,,,,,,,,,,Khorasan Chapter of the Islamic State,,,,,,"The specific motive is unknown; however, sources suspected that the victims, who were members of the Hazara Shiite community, may have been targeted as part of a larger trend of sectarian violence between Afghanistan's majority Sunni and minority Shiite communities.",0.0,,,0,3.0,0.0,1.0,7.0,"Posted to website, blog, etc.",,,,,,,,6,Explosives,13.0,Suicide (carried bodily by human being),,,,,,,,,,,,,Three explosives-laden belts were used in the attack.,83.0,0.0,3.0,230.0,0.0,0.0,-9,,,,,0.0,,,,,,,,,,,,,,,,"Casualty numbers for this incident conflict across sources. Following GTD protocol, the lowest reliable estimates are reported here.","""ISIS targets minority group; 80 dead,"" CNN, July 23, 2016.","""Deadly blast hits Kabul protest march,"" BBC, July 23, 2016.","""Twin blasts at Kabul rally leave 80 dead, 231 hurt,"" Qatar Tribune, July 24, 2016.",START Primary Collection,0,1,0,1,
165903,201608010013,2016,8,1,,0,,4,Afghanistan,6,South Asia,Kabul,Kabul,34.516895,69.147014,1.0,0,The incident occurred in the Dispichri area of the 9th police district.,"08/01/2016: A suicide bomber detonated an explosives-laden vehicle at North Gate Hotel in Dispichri neighborhood, Kabul, Afghanistan. Following the blast, assailants wearing suicide vests and armed with projectiles and firearms attacked the hotel. At least four people, including one Afghan Police officer and three assailants, were killed and three other officers were injured in the blast and ensuing clash. The Taliban claimed responsibility and stated that the attack was carried out in retaliation for the death of their leader.",1,1,1,0,,,0.0,1,1,3,Bombing/Explosion,2.0,Armed Assault,,,1,Business,8.0,Hotel/Resort,North Gate Hotel,Hotel,4.0,Afghanistan,,,,,,,,,,,,,,,,,Taliban,,,,,,"The Taliban claimed responsibility for the incident and stated that the attack was carried out in retaliation for the death of Taliban leader, Mullah Akhtar Muhammad Mansur.",0.0,,,0,4.0,0.0,1.0,7.0,"Posted to website, blog, etc.",,,,,,,,6,Explosives,15.0,Vehicle,6.0,Explosives,11.0,"Projectile (rockets, mortars, RPGs, etc.)",5.0,Firearms,2.0,Automatic or Semi-Automatic Rifle,,,,,"An explosives-laden truck, rocket-propelled grenades (RPGs), and assault rifles were used in the attack.",4.0,0.0,3.0,3.0,0.0,0.0,1,3.0,Minor (likely < $1 million),-99.0,Unspecified property was damaged in this attack.,0.0,,,,,,,,,,,,,,,,"Casualty numbers for this incident conflict across sources. Following GTD protocol, the majority reliable estimates are reported here.","""Kabul's 'foreign base' hit by Taliban,"" BBC, August 1, 2016.","""1st LD: 4 killed, 3 injured in Kabul massive truck bombing: police,"" Xinhua General News Service, August 1, 2016.","""Truck Bomber, Gunmen Attack Foreigners' Hotel In Kabul,"" Radio Free Europe, August 1, 2016.",START Primary Collection,0,0,0,0,
167212,201609050002,2016,9,5,,0,,4,Afghanistan,6,South Asia,Kabul,Kabul,34.516895,69.147014,1.0,0,,"09/05/2016: A suicide bomber detonated near the Defense Ministry in Kabul, Afghanistan. This was one of two coordinated suicide attacks in the area on the same day. In addition to the assailants, at least 41 people were killed and 110 people were injured in both blasts. The Taliban claimed responsibility for the incidents.",1,1,1,0,,,1.0,1,1,3,Bombing/Explosion,,,,,14,Private Citizens & Property,67.0,Unnamed Civilian/Unspecified,Not Applicable,Civilians,4.0,Afghanistan,,,,,,,,,,,,,,,,,Taliban,,,,,,,0.0,,,0,1.0,0.0,1.0,7.0,"Posted to website, blog, etc.",,,,,,,,6,Explosives,13.0,Suicide (carried bodily by human being),,,,,,,,,,,,,,22.0,0.0,1.0,55.0,0.0,0.0,1,4.0,Unknown,-99.0,Unspecified property was damaged in this attack,0.0,,,,,,,,,,,,,,,,"Casualty numbers represent a division of the total number of those killed and wounded across incidents 201609050002 and 201609050003. Additionally, casualty numbers conflict across sources. Following GTD protocol, the most recent reliable estimates are reported here.","""Afghanistan: Kabul suicide toll rises to 41 dead, 110 wounded: Officials,"" Khaama Press Online, September 7, 2016.","""Death toll in Kabul twin suicide blasts rise to 37; AFGHANISTAN ATTACK,"" EFE Newswire - Americas in Focus, September 6, 2016.","""Roundup: String of insurgent attacks in Kabul cause panic among Afghans, leaving many in distress,"" Xinhua General News Service, September 6, 2016.",START Primary Collection,0,0,0,0,"201609050002, 201609050003"
167213,201609050003,2016,9,5,,0,,4,Afghanistan,6,South Asia,Kabul,Kabul,34.516895,69.147014,1.0,0,,"09/05/2016: A suicide bomber detonated near the Defense Ministry in Kabul, Afghanistan. This was one of two coordinated suicide attacks in the area on the same day. In addition to the assailants, at least 41 people were killed and 110 people were injured in both blasts. The Taliban claimed responsibility for the incidents.",1,1,1,0,,,1.0,1,1,3,Bombing/Explosion,,,,,14,Private Citizens & Property,67.0,Unnamed Civilian/Unspecified,Not Applicable,Civilians,4.0,Afghanistan,,,,,,,,,,,,,,,,,Taliban,,,,,,,0.0,,,0,1.0,0.0,1.0,7.0,"Posted to website, blog, etc.",,,,,,,,6,Explosives,13.0,Suicide (carried bodily by human being),,,,,,,,,,,,,,21.0,0.0,1.0,55.0,0.0,0.0,1,4.0,Unknown,-99.0,Unspecified property was damaged in this attack.,0.0,,,,,,,,,,,,,,,,"Casualty numbers represent a division of the total number of those killed and wounded across incidents 201609050002 and 201609050003. Additionally, casualty numbers conflict across sources. Following GTD protocol, the most recent reliable estimates are reported here.","""Afghanistan: Kabul suicide toll rises to 41 dead, 110 wounded: Officials,"" Khaama Press Online, September 7, 2016.","""Death toll in Kabul twin suicide blasts rise to 37; AFGHANISTAN ATTACK,"" EFE Newswire - Americas in Focus, September 6, 2016.","""Roundup: String of insurgent attacks in Kabul cause panic among Afghans, leaving many in distress,"" Xinhua General News Service, September 6, 2016.",START Primary Collection,0,0,0,0,"201609050002, 201609050003"
168527,201610110006,2016,10,11,,0,,4,Afghanistan,6,South Asia,Kabul,Kabul,34.516895,69.147014,1.0,0,The incident occurred in the Karte Sakhi shrine area.,"10/11/2016: An assailant opened fire at the Karte Sakhi shrine in Kabul, Afghanistan. At least 15 people, including the assailant, were killed and 36 others were injured in the attack. This was one of two attacks on religious institutions in Kabul on this date. The Khorasan Chapter of the Islamic State claimed responsibility for the incident, identifying the assailant as Ali Jan.",1,1,1,0,,,1.0,1,0,2,Armed Assault,,,,,15,Religious Figures/Institutions,87.0,Affiliated Institution,Karte Sakhi Shrine,Shrine,4.0,Afghanistan,,,,,,,,,,,,,,,,,Khorasan Chapter of the Islamic State,,,,,,"The specific motive is unknown; however, sources posited that the attack was part of a larger trend of sectarian violence between Afghanistan's majority Sunni and minority Shiite communities.",0.0,,,0,1.0,0.0,1.0,7.0,"Posted to website, blog, etc.",,,,,,,,6,Explosives,7.0,Grenade,5.0,Firearms,2.0,Automatic or Semi-Automatic Rifle,5.0,Firearms,3.0,Handgun,,,,,"Grenades, machine guns, an AK-47 assault rifle, and a pistol were used in the attack.",15.0,0.0,1.0,36.0,0.0,0.0,-9,,,,,0.0,,,,,,,,,,,,,,,,"Casualty numbers conflict across sources. Following GTD protocol, the majority reliable estimates are reported here.","""Gunman kills 14 at Shiite shrine in Kabul,"" CNN, October 11, 2016.","""Gunmen target Shia worshipers marking Ashoura in Kabul,"" Al Jazeera, October 11, 2016.","""ISKP Foments Sectarianism,"" Daily Outlook, October 22, 2016.",START Primary Collection,0,1,0,1,"201610110006, 201610110048"
170153,201611210001,2016,11,21,,0,,4,Afghanistan,6,South Asia,Kabul,Kabul,34.516895,69.147014,1.0,0,The incident occurred in the Char Qala area.,"11/21/2016: A suicide bomber detonated at the Baqir Olum mosque in Char Qala, Kabul, Afghanistan. In addition to the assailant, at least 27 people were killed and 35 people were injured in the blast. The Khorasan Chapter of the Islamic State claimed responsibility for the incident.",1,1,1,0,,,0.0,1,1,3,Bombing/Explosion,,,,,15,Religious Figures/Institutions,86.0,Place of Worship,Unknown,Shiite Mosque,4.0,Afghanistan,,,,,,,,,,,,,,,,,Khorasan Chapter of the Islamic State,,,,,,"The specific motive is unknown; however, sources suspected that the attack, which targeted a Shiite mosque, may have been targeted as part of a larger trend of sectarian violence between Afghanistan's majority Sunni and minority Shiite communities.",0.0,,,0,1.0,0.0,1.0,7.0,"Posted to website, blog, etc.",,,,,,,,6,Explosives,13.0,Suicide (carried bodily by human being),,,,,,,,,,,,,An explosives-laden vest was used in the attack.,28.0,0.0,1.0,35.0,0.0,0.0,1,4.0,Unknown,-99.0,A mosque was damaged in this attack.,0.0,,,,,,,,,,,,,,,,"Casualty numbers conflict across sources. Following GTD protocol, the lowest reliable estimates are reported here.","""At least 27 die in Kabul mosque bombing,"" The Statesman (AsiaNet), November 22, 2016.","""Daesh Claims Responsibility For Kabul Mosque Bombing,"" Tolo News, November 22, 2016.","""Kabul mosque attack death toll at 27 - police,"" Channel NewsAsia, November 21, 2016.",START Primary Collection,0,1,0,1,
171790,201701100003,2017,1,10,,0,,4,Afghanistan,6,South Asia,Kabul,Kabul,34.516895,69.147014,1.0,0,The incident occurred along the Darulaman Road.,"01/10/2017: A suicide bomber detonated an explosives-laden vehicle targeting rescue personnel and civilians gathering in response to an earlier bombing near the parliament building along Darulaman road in Kabul, Afghanistan. This was one of two coordinated attacks at the same location in a short period of time. At least 38 people were killed and 72 people were injured across both events. The Taliban claimed responsibility for the incident and accused the victims of working for the Afghan intelligence agency.",1,1,1,0,,,1.0,1,1,3,Bombing/Explosion,,,,,14,Private Citizens & Property,67.0,Unnamed Civilian/Unspecified,Not Applicable,Civilians,4.0,Afghanistan,3.0,Police,25.0,Police Security Forces/Officers,Afghan Police,Officers,4.0,Afghanistan,,,,,,,,,Taliban,,,,,,The Taliban claimed responsibility for the incident and accused the victims of working for the Afghan intelligence agency.,0.0,,,0,-99.0,0.0,1.0,8.0,Personal claim,,,,,,,,6,Explosives,15.0,Vehicle,,,,,,,,,,,,,,20.0,0.0,1.0,36.0,0.0,0.0,-9,,,,,0.0,,,,,,,,,,,,,,,,"Casualty numbers conflict across sources. Following GTD protocol, the majority reliable estimates are reported here. Casualty numbers represent a division of the total number of those killed and wounded across incidents 201701100002 and 201701100003.","""Kabul explosions: 21 killed near Afghan parliament compound,"" CNN, January 10, 2017.","""36 Afghan parliament staff killed in Kabul attack,"" Khaama Press, January 11, 2017.","""Afghanistan Taliban claim Kabul double bomb attack near American University,"" CBS News, January 10, 2017.",START Primary Collection,0,0,0,0,"201701100002, 201701100003"
176949,201706150021,2017,6,15,,0,,4,Afghanistan,6,South Asia,Kabul,Kabul,34.516895,69.147014,1.0,0,The incident occurred in the Dasht-e-Barchi area of the city.,"06/15/2017: Two suicide bombers armed with firearms attacked Al Zahra Mosque in Dasht-e-Barchi, Kabul, Afghanistan. In addition to the two assailants, four people were killed and seven people were injured in the attack. The Khorasan Chapter of the Islamic State claimed responsibility for the incident.",1,1,1,0,,,0.0,1,1,3,Bombing/Explosion,,,,,15,Religious Figures/Institutions,86.0,Place of Worship,Al Zahra Mosque,Mosque,4.0,Afghanistan,3.0,Police,25.0,Police Security Forces/Officers,Afghan Police,Officers,4.0,Afghanistan,,,,,,,,,Khorasan Chapter of the Islamic State,,,,,,,0.0,,,0,2.0,0.0,1.0,7.0,"Posted to website, blog, etc.",,,,,,,,6,Explosives,13.0,Suicide (carried bodily by human being),5.0,Firearms,3.0,Handgun,,,,,,,,,Explosives-laden vests and handguns were used in the attack.,6.0,0.0,2.0,7.0,0.0,0.0,1,4.0,Unknown,-99.0,A mosque was damaged in this attack.,0.0,,,,,,,,,,,,,,,,"The victims include Ramazan Husainzada Haji Ramazan. Casualty numbers conflict across sources. Following GTD protocol, the majority reliable estimates are reported here.","""Kabul attack: 'Blast and gunfire' at Shia mosque,"" BBC, June 15, 2017.","""4 At Least 6 Killed In Kabul Mosque Explosion,"" Tolo News, June 17, 2017.","""4 killed, 7 injured in Kabul mosque attack: official,"" Xinhua General News Service, June 15, 2017.",START Primary Collection,0,1,0,1,
179322,201708250001,2017,8,25,,0,,4,Afghanistan,6,South Asia,Kabul,Kabul,34.516895,69.147014,1.0,0,The incident occurred in the Qala-e Najara area of the 11th police district.,"08/25/2017: Four assailants, armed with grenades, firearms, and knives attacked the Imam Zaman Mosque in Qala-e Najara, Kabul, Afghanistan. In addition to the four assailants, at least one of whom was a suicide bomber, 28 people were killed and 50 others were injured in the attack. The Khorasan Chapter of the Islamic State claimed responsibility for the incident, stating that the attack was in response to a cleric promoting the killing of Khorasan Chapter members.",1,1,1,0,,,0.0,1,1,3,Bombing/Explosion,2.0,Armed Assault,,,15,Religious Figures/Institutions,86.0,Place of Worship,Imam Zaman Mosque,Mosque,4.0,Afghanistan,,,,,,,,,,,,,,,,,Khorasan Chapter of the Islamic State,,,,,,"The Khorasan Chapter of the Islamic State claimed responsibility for the incident and stated that the attack was carried out in response to the mosque's imam promoting the defeat of the Islamic State of Iraq and the Levant (ISIL) in Mosul. Additionally, sources posited that the victims, who were predominantly members of the Shia Muslim community, may have been targeted as part of a larger trend of sectarian violence between Afghanistan's majority Sunni and minority Shia communities.",0.0,,,0,4.0,0.0,1.0,7.0,"Posted to website, blog, etc.",,,,,,,,6,Explosives,13.0,Suicide (carried bodily by human being),6.0,Explosives,7.0,Grenade,5.0,Firearms,2.0,Automatic or Semi-Automatic Rifle,,,,,"Multiple 12-kilogram explosives-laden vests, grenades, Kalashnikov assault rifles, and knives were used in the attack.",32.0,0.0,4.0,50.0,0.0,0.0,1,3.0,Minor (likely < $1 million),-99.0,A mosque was damaged in this attack.,0.0,,,,,,,,,,,,,,,,"Casualty numbers conflict across sources. Following GTD protocol, the majority reliable estimates are reported here.","""Death toll from attack on Afghan Shia rises to 28,"" Al Jazeera, August 26, 2017.","""Death Toll Rises To 28 In Kabul Shi'ite Mosque Attack,"" Radio Free Europe, August 26, 2017.","""At least 30 reported slain in Kabul siege,"" The Washington Post, August 26, 2017.",START Primary Collection,0,1,0,1,
179505,201708290006,2017,8,29,,0,,4,Afghanistan,6,South Asia,Kabul,Kabul,34.516895,69.147014,1.0,0,The incident occurred in the Microrayan-e-Duwum area of the 9th police district.,"08/29/2017: A suicide bomber detonated targeting a New Kabul Bank branch in Microrayan-e-Duwum, Kabul, Afghanistan. In addition to the assailant, at least five people were killed and eight people were injured in the blast. A second assailant was arrested by security forces at the scene. The Taliban claimed responsibility for the attack.",1,1,1,0,,,0.0,1,1,3,Bombing/Explosion,,,,,1,Business,3.0,Bank/Commerce,New Kabul Bank (NKB),Bank,4.0,Afghanistan,,,,,,,,,,,,,,,,,Taliban,,,,,,,0.0,,,0,2.0,1.0,1.0,4.0,E-mail,,,,,,,,6,Explosives,13.0,Suicide (carried bodily by human being),,,,,,,,,,,,,,6.0,0.0,1.0,8.0,0.0,0.0,1,3.0,Minor (likely < $1 million),-99.0,A bank and nearby property were damaged in this attack.,0.0,,,,,,,,,,,,,,,,"Casualty numbers conflict across sources. Following GTD protocol, the majority reliable estimates are reported here.","""Taliban bomber kills five at Kabul bank,"" The Washington Post, August 30, 2017.","""2nd LD Writethru: Suicide attack in Kabul claims 5 lives, wounds 8,"" Xinhua General News Service, August 29, 2017.","""Suicide attack near NKB in Kabul claims 5 lives,"" SalamWatandar.com, August 29, 2017.",START Primary Collection,0,0,0,0,
180379,201709290011,2017,9,29,,0,,4,Afghanistan,6,South Asia,Kabul,Kabul,34.516895,69.147014,1.0,0,The incident occurred in the Qala-e-Fathullah neighborhood in the 10th police district.,"09/29/2017: A suicide bomber detonated targeting a Shia Muslim mosque in Qala-e-Fathullah, Kabul, Afghanistan. In addition to the assailant, five civilians were killed and 20 others were injured in the blast. The Khorasan Chapter of the Islamic State claimed responsibility for the incident.",1,1,1,0,,,0.0,1,1,3,Bombing/Explosion,,,,,15,Religious Figures/Institutions,86.0,Place of Worship,Unknown,Shia Mosque,4.0,Afghanistan,14.0,Private Citizens & Property,67.0,Unnamed Civilian/Unspecified,Not Applicable,Civilians,4.0,Afghanistan,,,,,,,,,Khorasan Chapter of the Islamic State,,,,,,"The specific motive is unknown; however, sources suspected that the victims, predominantly Shia Muslims, were targeted as part of a larger trend of sectarian violence between Afghanistan's majority Sunni and minority Shia communities.",0.0,,,0,1.0,0.0,1.0,7.0,"Posted to website, blog, etc.",,,,,,,,6,Explosives,13.0,Suicide (carried bodily by human being),,,,,,,,,,,,,An explosives-laden vest was used in the attack.,6.0,0.0,1.0,20.0,0.0,0.0,0,,,,,0.0,,,,,,,,,,,,,,,,"Casualty numbers conflict across sources. Following GTD protocol, the majority reliable estimates are reported here.","""IS claims responsibility for suicide bombing near Kabul Shiite mosque,"" Deutsche Presse-Agentur, September 29, 2017.","""Suicide bomb blast near Kabul mosque blast kills five,"" Al Jazeera, September 29, 2017.","""Death toll rises to five in Kabul blast,"" Ani News, September 29, 2017.",START Primary Collection,0,1,0,1,
